{"point_id": "06b8c422-6406-5a39-8e80-12fe28c4250c", "session_id": "all", "chunk_index": 0, "chunk_first_id": 1, "chunk_last_id": 51, "semantic_summary": "Друзья обсуждают повседневные трудности, утомление, необходимость отдыха и текущее состояние. Казах и Шимон обмениваются короткими сообщениями, часто с эмоциональной окраской, и упоминают события, происходящие в их жизни, такие как работа, отдых, и личные переживания. В ходе разговора они также касаются тем, связанных с их общей жизнью и отношениями.\nMem Шимон: Заебался я что перезагружается, надеюсь что поможет\nMem Шимон: Ну такое, не сказать что хорошо, но заебался, и завтра тоже на работу\nMem Шимон: Еду с работы\nMem Шимон: Я хочу спать\nMem Шимон: Может по спим?\nMem Шимон: Да пиздец сегодня денек\nMem Шимон: Ебнутые ходили как будто дурку выпустили\nMem Шимон: Ну такое\nMem Шимон: По ветру?\nMem Шимон: У меня к тебе вопрос по кашруту\nMem Казах: От него все зависит\nMem Казах: Ты дэ?\nMem Казах: Каеф\nMem Казах: Брат\nMem Казах: Ахи\nMem Казах: Ахпер\nMem Казах: Ты скажи мне где ты есть\nMem Казах: Курить почапали?\nMem Казах: Ну шо ты пажилой десигнер?\nMem Казах: Та не, я кушаю\nMem Казах: Муд на сегодня\nMem Казах: Якшимаш?\nMem Казах: Главное очко\nMem Казах: Ого\nMem Казах: Ты жив?\nMem Казах: В напряг\nMem Казах: А нос по ветру\nMem Казах: Я вот с трени иду\nMem Казах: С Мойшиком вот \"обнимался\"\nMem Казах: Ща у Вольфа спрошу\nMem Казах: Ты скажи мне где ты есть\nMem Казах: Курить почапали?\nMem Казах: Ну шо ты пажилой десигнер?\nMem Казах: Та не, я кушаю\nMem Казах: Муд на сегодня\nMem Казах: Якшимаш?\nMem Казах: Главное очко\nMem Казах: Ого\nMem Казах: Ты жив?\nMem Казах: В напряг\nMem Казах: А нос по ветру\nMem Казах: Я вот с трени иду\nMem Казах: С Мойшиком вот \"обнимался\"\nMem Казах: Ща у Вольфа спрошу\nКазах: друг\nШимон: автор; друг\nRel: Казах — обнимался — Мойшик (на момент разговора)\nRel: Казах — спрашивает — Вольф (на момент разговора)\nRel: Шимон — указывает — Хряков (на момент разговора)", "persona": {"participants": [{"id": "Казах", "name": "Казах", "stance": ["друг"]}, {"id": "Шимон", "name": "Шимон", "stance": ["автор", "друг"]}], "summary": "Друзья обсуждают повседневные трудности, утомление, необходимость отдыха и текущее состояние. Казах и Шимон обмениваются короткими сообщениями, часто с эмоциональной окраской, и упоминают события, происходящие в их жизни, такие как работа, отдых, и личные переживания. В ходе разговора они также касаются тем, связанных с их общей жизнью и отношениями.", "tags": ["друзья", "повседневность", "утомление", "отдых", "отношения"], "memories": [{"speaker_id": "Шимон", "text": "Заебался я что перезагружается, надеюсь что поможет", "durability": "long"}, {"speaker_id": "Шимон", "text": "Ну такое, не сказать что хорошо, но заебался, и завтра тоже на работу", "durability": "long"}, {"speaker_id": "Шимон", "text": "Еду с работы", "durability": "long"}, {"speaker_id": "Шимон", "text": "Я хочу спать", "durability": "long"}, {"speaker_id": "Шимон", "text": "Может по спим?", "durability": "long"}, {"speaker_id": "Шимон", "text": "Да пиздец сегодня денек", "durability": "long"}, {"speaker_id": "Шимон", "text": "Ебнутые ходили как будто дурку выпустили", "durability": "long"}, {"speaker_id": "Шимон", "text": "Ну такое", "durability": "long"}, {"speaker_id": "Шимон", "text": "По ветру?", "durability": "long"}, {"speaker_id": "Шимон", "text": "У меня к тебе вопрос по кашруту", "durability": "long"}, {"speaker_id": "Казах", "text": "От него все зависит", "durability": "long"}, {"speaker_id": "Казах", "text": "Ты дэ?", "durability": "long"}, {"speaker_id": "Казах", "text": "Каеф", "durability": "long"}, {"speaker_id": "Казах", "text": "Брат", "durability": "long"}, {"speaker_id": "Казах", "text": "Ахи", "durability": "long"}, {"speaker_id": "Казах", "text": "Ахпер", "durability": "long"}, {"speaker_id": "Казах", "text": "Ты скажи мне где ты есть", "durability": "long"}, {"speaker_id": "Казах", "text": "Курить почапали?", "durability": "long"}, {"speaker_id": "Казах", "text": "Ну шо ты пажилой десигнер?", "durability": "long"}, {"speaker_id": "Казах", "text": "Та не, я кушаю", "durability": "long"}, {"speaker_id": "Казах", "text": "Муд на сегодня", "durability": "long"}, {"speaker_id": "Казах", "text": "Якшимаш?", "durability": "long"}, {"speaker_id": "Казах", "text": "Главное очко", "durability": "long"}, {"speaker_id": "Казах", "text": "Ого", "durability": "long"}, {"speaker_id": "Казах", "text": "Ты жив?", "durability": "long"}, {"speaker_id": "Казах", "text": "В напряг", "durability": "long"}, {"speaker_id": "Казах", "text": "А нос по ветру", "durability": "long"}, {"speaker_id": "Казах", "text": "Я вот с трени иду", "durability": "long"}, {"speaker_id": "Казах", "text": "С Мойшиком вот \"обнимался\"", "durability": "long"}, {"speaker_id": "Казах", "text": "Ща у Вольфа спрошу", "durability": "long"}, {"speaker_id": "Казах", "text": "Ты скажи мне где ты есть", "durability": "long"}, {"speaker_id": "Казах", "text": "Курить почапали?", "durability": "long"}, {"speaker_id": "Казах", "text": "Ну шо ты пажилой десигнер?", "durability": "long"}, {"speaker_id": "Казах", "text": "Та не, я кушаю", "durability": "long"}, {"speaker_id": "Казах", "text": "Муд на сегодня", "durability": "long"}, {"speaker_id": "Казах", "text": "Якшимаш?", "durability": "long"}, {"speaker_id": "Казах", "text": "Главное очко", "durability": "long"}, {"speaker_id": "Казах", "text": "Ого", "durability": "long"}, {"speaker_id": "Казах", "text": "Ты жив?", "durability": "long"}, {"speaker_id": "Казах", "text": "В напряг", "durability": "long"}, {"speaker_id": "Казах", "text": "А нос по ветру", "durability": "long"}, {"speaker_id": "Казах", "text": "Я вот с трени иду", "durability": "long"}, {"speaker_id": "Казах", "text": "С Мойшиком вот \"обнимался\"", "durability": "long"}, {"speaker_id": "Казах", "text": "Ща у Вольфа спрошу", "durability": "long"}], "entities": [{"name": "Мойшик", "type": "person", "aliases": ["Мойшик"], "relations": [{"subject": "Казах", "predicate": "обнимался", "object": "Мойшик", "durability": "long", "when": "на момент разговора"}]}, {"name": "Вольф", "type": "person", "aliases": ["Вольф"], "relations": [{"subject": "Казах", "predicate": "спрашивает", "object": "Вольф", "durability": "long", "when": "на момент разговора"}]}, {"name": "Хряков", "type": "person", "aliases": ["Хряков"], "relations": [{"subject": "Шимон", "predicate": "указывает", "object": "Хряков", "durability": "long", "when": "на момент разговора"}]}], "alias_map": {"Мойшик": "Мойшик", "Вольф": "Вольф", "Хряков": "Хряков"}}, "dedup_key": "bb8d18dad766b08d654586dee70d94121b9fd706", "alias_map": {"Мойшик": "Мойшик", "Вольф": "Вольф", "Хряков": "Хряков"}}
{"point_id": "77835046-e3cc-5acf-a73e-3fdf60bd097e", "session_id": "all", "chunk_index": 2, "chunk_first_id": 102, "chunk_last_id": 151, "semantic_summary": "Друзья обсуждают отношения между собой и другими людьми, выражая чувства и намерения. Шимон делится своими эмоциями и мыслями о человеке, называемом \"антамоном\", и упоминает события в разных местах, включая торговый центр и подъезд. Казах отвечает, используя прозвища и выражения, а также упоминает, что у него есть бабушка и что он на работе.\nMem Казах: Ну цэ безответная любовь\nMem Шимон: Между нами искра пробежала\nMem Шимон: Тогда на кухне\nMem Шимон: Да нихуя\nMem Казах: Ни\nMem Казах: Ну антамонов же гетеро\nMem Шимон: Так дело же не в этом, я тебе про чистые чувства\nMem Казах: Поясни\nMem Шимон: Ну просто он прикольный, я раньше этого не замечал\nMem Шимон: Все эти фразочки\nMem Казах: А это братская любовь\nMem Казах: Брат\nMem Казах: Вац\nMem Казах: По братски\nMem Казах: Купи сиг\nMem Шимон: ok\nMem Казах: Братишка\nMem Казах: Я сам брат\nMem Казах: Хотя не надо боат\nMem Казах: Вац\nMem Казах: Ты где?\nMem Шимон: Захожу в подьезд\nMem Шимон: В лифте\nMem Казах: Выхожу\nMem Шимон: Ты поедешь с нами?\nMem Казах: Не, я у бабули\nMem Казах: Я везу тоби тортек\nMem Шимон: Спасибо😘\nMem Казах: Хуевый ТЦ\nMem Шимон: Нет\nMem Шимон: Да\nMem Казах: Вы еще в тц?\nMem Казах: А там табачка есть?\nMem Казах: Я вас вижу\nMem Шимон: А мы тебя нет\nMem Казах: Пошли да курить\nMem Шимон: Пошли щас\nMem Шимон: Я только проснулся\nMem Казах: Я на работе брат\nMem Казах: Хрони тебя Бох\nMem Шимон: А зачем звал\nMem Казах: Я думал ты ранняя пташка\nMem Казах: А ты пажилой журавль\nMem Казах: Ну шо ты ворон\nMem Шимон: Да я уставший какой-то\nMem Шимон: Еле чехлы собираю\nMem Казах: А шо такое\nMem Шимон: Низнаю как вареная скумбрия\nMem Казах: Ооо\nMem Казах: У тебя походу скумброз\nКазах: друг\nШимон: автор\nRel: Шимон — говорит о — антамон (в ходе разговора)\nRel: Казах — имеет — бабушку (в ходе разговора)\nRel: Казах — указывает на — ТЦ (в ходе разговора)\nRel: Шимон — указывает на — подъезд (в ходе разговора)\nRel: Шимон — указывает на — лифт (в ходе разговора)", "persona": {"participants": [{"id": "Казах", "name": "Казах", "stance": ["друг"]}, {"id": "Шимон", "name": "Шимон", "author": true, "stance": ["автор"]}], "summary": "Друзья обсуждают отношения между собой и другими людьми, выражая чувства и намерения. Шимон делится своими эмоциями и мыслями о человеке, называемом \"антамоном\", и упоминает события в разных местах, включая торговый центр и подъезд. Казах отвечает, используя прозвища и выражения, а также упоминает, что у него есть бабушка и что он на работе.", "tags": ["дружба", "чувства", "места", "прозвища", "разговор"], "memories": [{"speaker_id": "Казах", "text": "Ну цэ безответная любовь", "durability": "long"}, {"speaker_id": "Шимон", "text": "Между нами искра пробежала", "durability": "long"}, {"speaker_id": "Шимон", "text": "Тогда на кухне", "durability": "long"}, {"speaker_id": "Шимон", "text": "Да нихуя", "durability": "long"}, {"speaker_id": "Казах", "text": "Ни", "durability": "long"}, {"speaker_id": "Казах", "text": "Ну антамонов же гетеро", "durability": "long"}, {"speaker_id": "Шимон", "text": "Так дело же не в этом, я тебе про чистые чувства", "durability": "long"}, {"speaker_id": "Казах", "text": "Поясни", "durability": "long"}, {"speaker_id": "Шимон", "text": "Ну просто он прикольный, я раньше этого не замечал", "durability": "long"}, {"speaker_id": "Шимон", "text": "Все эти фразочки", "durability": "long"}, {"speaker_id": "Казах", "text": "А это братская любовь", "durability": "long"}, {"speaker_id": "Казах", "text": "Брат", "durability": "long"}, {"speaker_id": "Казах", "text": "Вац", "durability": "long"}, {"speaker_id": "Казах", "text": "По братски", "durability": "long"}, {"speaker_id": "Казах", "text": "Купи сиг", "durability": "long"}, {"speaker_id": "Шимон", "text": "ok", "durability": "long"}, {"speaker_id": "Казах", "text": "Братишка", "durability": "long"}, {"speaker_id": "Казах", "text": "Я сам брат", "durability": "long"}, {"speaker_id": "Казах", "text": "Хотя не надо боат", "durability": "long"}, {"speaker_id": "Казах", "text": "Вац", "durability": "long"}, {"speaker_id": "Казах", "text": "Ты где?", "durability": "long"}, {"speaker_id": "Шимон", "text": "Захожу в подьезд", "durability": "long"}, {"speaker_id": "Шимон", "text": "В лифте", "durability": "long"}, {"speaker_id": "Казах", "text": "Выхожу", "durability": "long"}, {"speaker_id": "Шимон", "text": "Ты поедешь с нами?", "durability": "long"}, {"speaker_id": "Казах", "text": "Не, я у бабули", "durability": "long"}, {"speaker_id": "Казах", "text": "Я везу тоби тортек", "durability": "long"}, {"speaker_id": "Шимон", "text": "Спасибо😘", "durability": "long"}, {"speaker_id": "Казах", "text": "Хуевый ТЦ", "durability": "long"}, {"speaker_id": "Шимон", "text": "Нет", "durability": "long"}, {"speaker_id": "Шимон", "text": "Да", "durability": "long"}, {"speaker_id": "Казах", "text": "Вы еще в тц?", "durability": "long"}, {"speaker_id": "Казах", "text": "А там табачка есть?", "durability": "long"}, {"speaker_id": "Казах", "text": "Я вас вижу", "durability": "long"}, {"speaker_id": "Шимон", "text": "А мы тебя нет", "durability": "long"}, {"speaker_id": "Казах", "text": "Пошли да курить", "durability": "long"}, {"speaker_id": "Шимон", "text": "Пошли щас", "durability": "long"}, {"speaker_id": "Шимон", "text": "Я только проснулся", "durability": "long"}, {"speaker_id": "Казах", "text": "Я на работе брат", "durability": "long"}, {"speaker_id": "Казах", "text": "Хрони тебя Бох", "durability": "long"}, {"speaker_id": "Шимон", "text": "А зачем звал", "durability": "long"}, {"speaker_id": "Казах", "text": "Я думал ты ранняя пташка", "durability": "long"}, {"speaker_id": "Казах", "text": "А ты пажилой журавль", "durability": "long"}, {"speaker_id": "Казах", "text": "Ну шо ты ворон", "durability": "long"}, {"speaker_id": "Шимон", "text": "Да я уставший какой-то", "durability": "long"}, {"speaker_id": "Шимон", "text": "Еле чехлы собираю", "durability": "long"}, {"speaker_id": "Казах", "text": "А шо такое", "durability": "long"}, {"speaker_id": "Шимон", "text": "Низнаю как вареная скумбрия", "durability": "long"}, {"speaker_id": "Казах", "text": "Ооо", "durability": "long"}, {"speaker_id": "Казах", "text": "У тебя походу скумброз", "durability": "long"}], "entities": [{"name": "антамон", "type": "person", "aliases": ["антамонов", "антамон"], "relations": [{"subject": "Шимон", "predicate": "говорит о", "object": "антамон", "durability": "long", "when": "в ходе разговора"}]}, {"name": "бабушка", "type": "person", "relations": [{"subject": "Казах", "predicate": "имеет", "object": "бабушку", "durability": "long", "when": "в ходе разговора"}]}, {"name": "ТЦ", "type": "place", "relations": [{"subject": "Казах", "predicate": "указывает на", "object": "ТЦ", "durability": "long", "when": "в ходе разговора"}]}, {"name": "подъезд", "type": "place", "relations": [{"subject": "Шимон", "predicate": "указывает на", "object": "подъезд", "durability": "long", "when": "в ходе разговора"}]}, {"name": "лифт", "type": "place", "relations": [{"subject": "Шимон", "predicate": "указывает на", "object": "лифт", "durability": "long", "when": "в ходе разговора"}]}], "alias_map": {"антамонов": "антамон", "Вац": "брат", "ТЦ": "торговый центр", "бабули": "бабушка", "пташка": "ранняя пташка", "журавль": "пажилой журавль", "ворон": "ворон", "скумбрия": "вареная скумбрия", "скумброз": "скумброза"}}, "dedup_key": "9644e86c26493ed3fe892bc940006cfa22110ce0", "alias_map": {"антамонов": "антамон", "Вац": "брат", "ТЦ": "торговый центр", "бабули": "бабушка", "пташка": "ранняя пташка", "журавль": "пажилой журавль", "ворон": "ворон", "скумбрия": "вареная скумбрия", "скумброз": "скумброза"}}
{"point_id": "592eab81-1e25-5999-a20e-8e495e039373", "session_id": "all", "chunk_index": 3, "chunk_first_id": 152, "chunk_last_id": 201, "semantic_summary": "Друзья обсуждают текущие проблемы и ситуации, включая личные трудности, инцидент с блокировкой в Инстаграмме, а также взаимоотношения и поддержку друг друга.\nMem Казах: Заходи, тортик поешь\nMem Казах: З чаюм\nMem Шимон: Сейчас можно?\nMem Казах: А то у меня тут музыка\nMem Казах: А телефон на зарядке. Я стук не услышу\nMem Казах: Ток позвони\nMem Казах: Заходи\nMem Казах: Канеш\nMem Казах: Впц\nMem Казах: Вац\nMem Казах: Лэ\nMem Казах: Как сам?\nMem Шимон: Да чо сижу замерз\nMem Шимон: Письку наверное не найду\nMem Шимон: Яички чувствую ближе к животу переместились\nMem Шимон: Вообщем вот так\nMem Казах: То есть тебе тяжело\nMem Казах: А я вот покурил в одиночестве\nMem Шимон: Не легко\nMem Шимон: Почему?\nMem Казах: Тебя нет\nMem Шимон: Это так грусно\nMem Шимон: <media>\nMem Шимон: А ещё меня в Инстаграмме забанили\nMem Казах: Ого\nMem Казах: Схуяли\nMem Шимон: За нарушение правил\nMem Шимон: Хотя я ничего не нарушал\nMem Шимон: Подал апелляцию пока ничего\nMem Казах: Хм\nMem Казах: <media>\nMem Шимон: че делаешь?\nMem Казах: Ты шо\nMem Шимон: сижу зажег свечки\nMem Казах: Ща зайду\nMem Казах: Мистер Андерсон\nMem Казах: Проснитесь\nMem Казах: Мистер Андерсон\nMem Казах: Зачем вы это делаете?\nMem Казах: Зачем вы встаете по утрам?\nMem Казах: Мистер Андерсон\nMem Шимон: 😒\nMem Казах: Держись брат\nMem Казах: А нехуй поздно ложиться\nMem Казах: Тяжело тебе\nMem Шимон: Очень\nMem Казах: Бирор\nMem Казах: Как ты\nMem Шимон: Заебался\nКазах: друг\nШимон: автор\nRel: Шимон — был заблокирован — Инстаграм (текущий момент)\nRel: Казах — обращается к — Мистер Андерсон (текущий момент)", "persona": {"participants": [{"id": "Казах", "name": "Казах", "stance": ["друг"]}, {"id": "Шимон", "name": "Шимон", "stance": ["автор"]}], "summary": "Друзья обсуждают текущие проблемы и ситуации, включая личные трудности, инцидент с блокировкой в Инстаграмме, а также взаимоотношения и поддержку друг друга.", "tags": ["друзья", "личные трудности", "соцсети", "поддержка"], "memories": [{"speaker_id": "Казах", "text": "Заходи, тортик поешь", "durability": "short"}, {"speaker_id": "Казах", "text": "З чаюм", "durability": "short"}, {"speaker_id": "Шимон", "text": "Сейчас можно?", "durability": "short"}, {"speaker_id": "Казах", "text": "А то у меня тут музыка", "durability": "short"}, {"speaker_id": "Казах", "text": "А телефон на зарядке. Я стук не услышу", "durability": "short"}, {"speaker_id": "Казах", "text": "Ток позвони", "durability": "short"}, {"speaker_id": "Казах", "text": "Заходи", "durability": "short"}, {"speaker_id": "Казах", "text": "Канеш", "durability": "short"}, {"speaker_id": "Казах", "text": "Впц", "durability": "short"}, {"speaker_id": "Казах", "text": "Вац", "durability": "short"}, {"speaker_id": "Казах", "text": "Лэ", "durability": "short"}, {"speaker_id": "Казах", "text": "Как сам?", "durability": "short"}, {"speaker_id": "Шимон", "text": "Да чо сижу замерз", "durability": "short"}, {"speaker_id": "Шимон", "text": "Письку наверное не найду", "durability": "short"}, {"speaker_id": "Шимон", "text": "Яички чувствую ближе к животу переместились", "durability": "short"}, {"speaker_id": "Шимон", "text": "Вообщем вот так", "durability": "short"}, {"speaker_id": "Казах", "text": "То есть тебе тяжело", "durability": "short"}, {"speaker_id": "Казах", "text": "А я вот покурил в одиночестве", "durability": "short"}, {"speaker_id": "Шимон", "text": "Не легко", "durability": "short"}, {"speaker_id": "Шимон", "text": "Почему?", "durability": "short"}, {"speaker_id": "Казах", "text": "Тебя нет", "durability": "short"}, {"speaker_id": "Шимон", "text": "Это так грусно", "durability": "short"}, {"speaker_id": "Шимон", "text": "<media>", "durability": "short"}, {"speaker_id": "Шимон", "text": "А ещё меня в Инстаграмме забанили", "durability": "long"}, {"speaker_id": "Казах", "text": "Ого", "durability": "short"}, {"speaker_id": "Казах", "text": "Схуяли", "durability": "short"}, {"speaker_id": "Шимон", "text": "За нарушение правил", "durability": "short"}, {"speaker_id": "Шимон", "text": "Хотя я ничего не нарушал", "durability": "short"}, {"speaker_id": "Шимон", "text": "Подал апелляцию пока ничего", "durability": "short"}, {"speaker_id": "Казах", "text": "Хм", "durability": "short"}, {"speaker_id": "Казах", "text": "<media>", "durability": "short"}, {"speaker_id": "Шимон", "text": "че делаешь?", "durability": "short"}, {"speaker_id": "Казах", "text": "Ты шо", "durability": "short"}, {"speaker_id": "Шимон", "text": "сижу зажег свечки", "durability": "short"}, {"speaker_id": "Казах", "text": "Ща зайду", "durability": "short"}, {"speaker_id": "Казах", "text": "Мистер Андерсон", "durability": "short"}, {"speaker_id": "Казах", "text": "Проснитесь", "durability": "short"}, {"speaker_id": "Казах", "text": "Мистер Андерсон", "durability": "short"}, {"speaker_id": "Казах", "text": "Зачем вы это делаете?", "durability": "short"}, {"speaker_id": "Казах", "text": "Зачем вы встаете по утрам?", "durability": "short"}, {"speaker_id": "Казах", "text": "Мистер Андерсон", "durability": "short"}, {"speaker_id": "Шимон", "text": "😒", "durability": "short"}, {"speaker_id": "Казах", "text": "Держись брат", "durability": "short"}, {"speaker_id": "Казах", "text": "А нехуй поздно ложиться", "durability": "short"}, {"speaker_id": "Казах", "text": "Тяжело тебе", "durability": "short"}, {"speaker_id": "Шимон", "text": "Очень", "dur (": "short"}, {"speaker_id": "Казах", "text": "Бирор", "durability": "short"}, {"speaker_id": "Казах", "text": "Как ты", "durability": "short"}, {"speaker_id": "Шимон", "text": "Заебался", "durability": "short"}], "entities": [{"name": "Инстаграм", "type": "other", "aliases": ["Инстаграм", "Инстаграмм"], "relations": [{"subject": "Шимон", "predicate": "был заблокирован", "object": "Инстаграм", "durability": "long", "when": "текущий момент"}]}, {"name": "Мистер Андерсон", "type": "person", "aliases": ["Мистер Андерсон"], "relations": [{"subject": "Казах", "predicate": "обращается к", "object": "Мистер Андерсон", "durability": "short", "when": "текущий момент"}]}], "alias_map": {"Впц": "Вперёд", "Вац": "Вперёд", "Лэ": "Ладно", "Канеш": "Канеш", "Бирор": "Бирор"}}, "dedup_key": "da7977e71899e2bdbe4dd1ae6bc21264a26bbfcf", "alias_map": {"Впц": "Вперёд", "Вац": "Вперёд", "Лэ": "Ладно", "Канеш": "Канеш", "Бирор": "Бирор"}}
{"point_id": "3aeaf243-92dd-5460-bb45-bf1a86f71df4", "session_id": "all", "chunk_index": 4, "chunk_first_id": 202, "chunk_last_id": 251, "semantic_summary": "Два друга обсуждают личную жизнь и текущее состояние. Казах выразил беспокойство по поводу отсутствия Шимона дома, но Шимон объяснил, что у него были дела. Позже они обсуждают различные темы, включая просмотр фильма, и сталкиваются с разницей в восприятии ситуации. Оба выражают эмоции, включая раздражение и злость.\nMem Казах: Брат\nMem Казах: Держись\nMem Казах: Брат\nMem Казах: Ты дэ?\nMem Казах: Ну как тебе\nMem Казах: Нормально у бажена\nMem Шимон: Я полис поехал делать на чипизацию\nMem Шимон: А ты ревнуешь?\nMem Казах: Мне похуй\nMem Шимон: Вот так?\nMem Казах: Как?\nMem Казах: Вы дома?\nMem Шимон: У бажена\nMem Шимон: Щас поедем домой\nMem Казах: А я у месифтэ\nMem Казах: Иду\nMem Шимон: Ты же сказал что дома\nMem Казах: У меня у жены сессия, вас нет (думал у вас потусить) поэтому иду в месифтэ\nMem Казах: К залми\nMem Шимон: Ну ок\nMem Шимон: Я поеду щас домой\nMem Казах: Главное в кайф\nMem Казах: Даже рукой мне не махнул\nMem Казах: Понятно все\nMem Казах: Вот так и теряют\nMem Казах: Братишек\nMem Шимон: Всмысле?\nMem Шимня: Я тебя не видел\nMem Казах: Ну да\nMem Казах: Ну як тебе довод?\nMem Казах: Ля ты крыса\nMem Шимон: Я не досмотрел\nMem Казах: Блят\nMem Казах: Ну это уже нэрэально\nMem Шимон: По моему мнению говнище\nMem Казах: Ты поэтому не досмотрел?\nMem Шимон: Может быть много факторов сложилось\nMem Казах: Ну як тебе довод?\nMem Казах: Ну да. Ты не высыпаешься\nMem Шимон: Я не понимаю\nMem Шимон: Те там скучно что-ли?\nMem Шимон: Чё я такой злой стал\nMem Шимон: Ну видишь у немеша чтото с родственниками\nКазах: друг\nШимон: автор\nRel: Казах — находится — бажена (в момент обсуждения)\nRel: Шимон — находится — бажена (в момент обсуждения)\nRel: Казах — находится — месифтэ (в момент обсуждения)\nRel: Шимон — смотрит — 1080p (в момент обсуждения)\nRel: Шимон — взаимодействует с — родственники (в момент обсуждения)", "persona": {"participants": [{"id": "Казах", "name": "Казах", "stance": ["друг"]}, {"id": "Шимон", "name": "Шимон", "stance": ["автор"]}], "summary": "Два друга обсуждают личную жизнь и текущее состояние. Казах выразил беспокойство по поводу отсутствия Шимона дома, но Шимон объяснил, что у него были дела. Позже они обсуждают различные темы, включая просмотр фильма, и сталкиваются с разницей в восприятии ситуации. Оба выражают эмоции, включая раздражение и злость.", "tags": ["дружба", "личная жизнь", "разногласия", "эмоции"], "memories": [{"speaker_id": "Казах", "text": "Брат", "durability": "long"}, {"speaker_id": "Казах", "text": "Держись", "durability": "long"}, {"speaker_id": "Казах", "text": "Брат", "durability": "long"}, {"speaker_id": "Казах", "text": "Ты дэ?", "durability": "long"}, {"speaker_id": "Казах", "text": "Ну как тебе", "durability": "long"}, {"speaker_id": "Казах", "text": "Нормально у бажена", "durability": "long"}, {"speaker_id": "Шимон", "text": "Я полис поехал делать на чипизацию", "durability": "long"}, {"speaker_id": "Шимон", "text": "А ты ревнуешь?", "durability": "long"}, {"speaker_id": "Казах", "text": "Мне похуй", "durability": "long"}, {"speaker_id": "Шимон", "text": "Вот так?", "durability": "long"}, {"speaker_id": "Казах", "text": "Как?", "durability": "long"}, {"speaker_id": "Казах", "text": "Вы дома?", "durability": "long"}, {"speaker_id": "Шимон", "text": "У бажена", "durability": "long"}, {"speaker_id": "Шимон", "text": "Щас поедем домой", "durability": "long"}, {"speaker_id": "Казах", "text": "А я у месифтэ", "durability": "long"}, {"speaker_id": "Казах", "text": "Иду", "durability": "long"}, {"speaker_id": "Шимон", "text": "Ты же сказал что дома", "durability": "long"}, {"speaker_id": "Казах", "text": "У меня у жены сессия, вас нет (думал у вас потусить) поэтому иду в месифтэ", "durability": "long"}, {"speaker_id": "Казах", "text": "К залми", "durability": "long"}, {"speaker_id": "Шимон", "text": "Ну ок", "durability": "long"}, {"speaker_id": "Шимон", "text": "Я поеду щас домой", "durability": "long"}, {"speaker_id": "Казах", "text": "Главное в кайф", "durability": "long"}, {"speaker_id": "Казах", "text": "Даже рукой мне не махнул", "durability": "long"}, {"speaker_id": "Казах", "text": "Понятно все", "durability": "long"}, {"speaker_id": "Казах", "text": "Вот так и теряют", "durability": "long"}, {"speaker_id": "Казах", "text": "Братишек", "durability": "long"}, {"speaker_id": "Шимон", "text": "Всмысле?", "durability": "long"}, {"speaker_id": "Шимня", "text": "Я тебя не видел", "durability": "long"}, {"speaker_id": "Казах", "text": "Ну да", "durability": "long"}, {"speaker_id": "Казах", "text": "Ну як тебе довод?", "durability": "long"}, {"speaker_id": "Казах", "text": "Ля ты крыса", "durability": "long"}, {"speaker_id": "Шимон", "text": "Я не досмотрел", "durability": "long"}, {"speaker_id": "Казах", "text": "Блят", "durability": "long"}, {"speaker_id": "Казах", "text": "Ну это уже нэрэально", "durability": "long"}, {"speaker_id": "Шимон", "text": "По моему мнению говнище", "durability": "long"}, {"speaker_id": "Казах", "text": "Ты поэтому не досмотрел?", "durability": "long"}, {"speaker_id": "Шимон", "text": "Может быть много факторов сложилось", "durability": "long"}, {"speaker_id": "Казах", "text": "Ну як тебе довод?", "durability": "long"}, {"speaker_id": "Казах", "text": "Ну да. Ты не высыпаешься", "durability": "long"}, {"speaker_id": "Шимон", "text": "Я не понимаю", "durability": "long"}, {"speaker_id": "Шимон", "text": "Те там скучно что-ли?", "durability": "long"}, {"speaker_id": "Шимон", "text": "Чё я такой злой стал", "durability": "long"}, {"speaker_id": "Шимон", "text": "Ну видишь у немеша чтото с родственниками", "durability": "long"}], "entities": [{"name": "бажена", "type": "place", "aliases": ["бажена"], "relations": [{"subject": "Казах", "predicate": "находится", "object": "бажена", "durability": "long", "when": "в момент обсуждения"}, {"subject": "Шимон", "predicate": "находится", "object": "бажена", "durability": "long", "when": "в момент обсуждения"}]}, {"name": "месифтэ", "type": "place", "aliases": ["месифтэ"], "relations": [{"subject": "Казах", "predicate": "находится", "object": "месифтэ", "durability": "long", "when": "в момент обсуждения"}]}, {"name": "1080p", "type": "other", "aliases": ["1080p"], "relations": [{"subject": "Шимон", "predicate": "смотрит", "object": "1080p", "durability": "long", "when": "в момент обсуждения"}]}, {"name": "родственники", "type": "other", "aliases": ["родственники"], "relations": [{"subject": "Шимон", "predicate": "взаимодействует с", "object": "родственники", "durability": "long", "when": "в момент обсуждения"}]}], "alias_map": {"бажена": "бажена", "месифтэ": "месифтэ", "1080p": "1080p", "родственники": "родственники"}}, "dedup_key": "d60f6e400bff428f8794945d93d62fafa5605c82", "alias_map": {"бажена": "бажена", "месифтэ": "месифтэ", "1080p": "1080p", "родственники": "родственники"}}
{"point_id": "41ceb009-9445-565c-b37e-d5b4b2aa97e4", "session_id": "all", "chunk_index": 5, "chunk_first_id": 252, "chunk_last_id": 301, "semantic_summary": "Два друга обсуждают личные проблемы и текущее состояние. Шимон выразил беспокойство из-за возможных последствий своих действий, а Казах поддерживает его, указывая на индивидуальные трудности каждого. Они обсуждают личную жизнь, ссылаясь на медиа, и планируют вместе провести время, куря и отдыхая.\nMem Шимон: Как я понял\nMem Казах: Ага\nMem Казах: А у тэбэ беды с башкой\nMem Шимон: С хуя ли?\nMem Казах: Я не знаю\nMem Шимон: Просто пишешь?\nMem Шимон: Неплохо было подумать прежде чем писать\nMem Шимон: Может я Джеки чан скрытый\nMem Шимон: А то ведь проблемы могут быть\nMem Казах: Не просто, но сосмылом\nMem Шимон: А пояснить за смысл можешь?\nMem Казах: Позже\nMem Казах: Так вот\nMem Казах: Беды с башкой у всех\nMem Казах: Но у каждого индивидуальные беды\nMem Казах: У тебя свои\nMem Казах: У меня свои\nMem Казах: У Кана свои\nMem Шимон: <media>\nMem Шимон: Сижу блять бабок омолаживаю\nMem Шимон: Дочего докатилась моя жизнь\nMem Казах: Бля ну это тоже дело\nMem Казах: Ты делаешь мир эстетичнее\nMem Казах: Ну шо ты пажилой\nMem Казах: <media>\nMem Казах: Ллееее\nMem Казах: Харэ бабок молодить\nMem Казах: Давай домой\nMem Шимон: Я приехал\nMem Казах: Леший\nMem Казах: Леший\nMem Шимон: Я злой пажилой дизайнер\nMem Казах: Чаво?\nMem Казах: Шо такое?\nMem Шимон: ﴾ꬼᶰᶑ₳ᶈձ₵﴿\nMem Шимон: Да нет в жизни счастья\nMem Шимон: Я одинокий волк\nMem Казах: Это да, но мы в силах порадовать себя\nMem Шимон: Это как?\nMem Казах: Каждый по своему\nMem Шимон: Ты как?\nMem Казах: Посмотрели фильм, пью чаек. Отдыхаю\nMem Казах: Ты до 8-ми сегодня?\nMem Казах: Или до 6-ти?\nMem Шимон: Как ты готов порадовать меня\nMem Шимон: Нет\nMem Шимон: Нет\nMem Шимон: До 19\nКазах: друг\nШимон: автор\nRel: Казах — указывает на — Кан (в ходе обсуждения личных трудностей)\nRel: Шимон — отправляет — медиа (во время обсуждения)\nRel: Казах — отправляет — медиа (во время обсуждения)", "persona": {"participants": [{"id": "Казах", "name": "Казах", "stance": ["друг"]}, {"id": "Шимон", "name": "Шимон", "stance": ["автор"]}], "summary": "Два друга обсуждают личные проблемы и текущее состояние. Шимон выразил беспокойство из-за возможных последствий своих действий, а Казах поддерживает его, указывая на индивидуальные трудности каждого. Они обсуждают личную жизнь, ссылаясь на медиа, и планируют вместе провести время, куря и отдыхая.", "tags": ["дружба", "личные проблемы", "медиа", "отдых", "поддержка"], "memories": [{"speaker_id": "Шимон", "text": "Как я понял", "durability": "long"}, {"speaker_id": "Казах", "text": "Ага", "durability": "long"}, {"speaker_id": "Казах", "text": "А у тэбэ беды с башкой", "durability": "long"}, {"speaker_id": "Шимон", "text": "С хуя ли?", "durability": "long"}, {"speaker_id": "Казах", "text": "Я не знаю", "durability": "long"}, {"speaker_id": "Шимон", "text": "Просто пишешь?", "durability": "long"}, {"speaker_id": "Шимон", "text": "Неплохо было подумать прежде чем писать", "durability": "long"}, {"speaker_id": "Шимон", "text": "Может я Джеки чан скрытый", "durability": "long"}, {"speaker_id": "Шимон", "text": "А то ведь проблемы могут быть", "durability": "long"}, {"speaker_id": "Казах", "text": "Не просто, но сосмылом", "durability": "long"}, {"speaker_id": "Шимон", "text": "А пояснить за смысл можешь?", "durability": "long"}, {"speaker_id": "Казах", "text": "Позже", "durability": "long"}, {"speaker_id": "Казах", "text": "Так вот", "durability": "long"}, {"speaker_id": "Казах", "text": "Беды с башкой у всех", "durability": "long"}, {"speaker_id": "Казах", "text": "Но у каждого индивидуальные беды", "durability": "long"}, {"speaker_id": "Казах", "text": "У тебя свои", "durability": "long"}, {"speaker_id": "Казах", "text": "У меня свои", "durability": "long"}, {"speaker_id": "Казах", "text": "У Кана свои", "durability": "long"}, {"speaker_id": "Шимон", "text": "<media>", "durability": "long"}, {"speaker_id": "Шимон", "text": "Сижу блять бабок омолаживаю", "durability": "long"}, {"speaker_id": "Шимон", "text": "Дочего докатилась моя жизнь", "durability": "long"}, {"speaker_id": "Казах", "text": "Бля ну это тоже дело", "durability": "long"}, {"speaker_id": "Казах", "text": "Ты делаешь мир эстетичнее", "durability": "long"}, {"speaker_id": "Казах", "text": "Ну шо ты пажилой", "durability": "long"}, {"speaker_id": "Казах", "text": "<media>", "durability": "long"}, {"speaker_id": "Казах", "text": "Ллееее", "durability": "long"}, {"speaker_id": "Казах", "text": "Харэ бабок молодить", "durability": "long"}, {"speaker_id": "Казах", "text": "Давай домой", "durability": "long"}, {"speaker_id": "Шимон", "text": "Я приехал", "durability": "long"}, {"speaker_id": "Казах", "text": "Леший", "durability": "long"}, {"speaker_id": "Казах", "text": "Леший", "durability": "long"}, {"speaker_id": "Шимон", "text": "Я злой пажилой дизайнер", "durability": "long"}, {"speaker_id": "Казах", "text": "Чаво?", "durability": "long"}, {"speaker_id": "Казах", "text": "Шо такое?", "durability": "long"}, {"speaker_id": "Шимон", "text": "﴾ꬼᶰᶑ₳ᶈձ₵﴿", "durability": "long"}, {"speaker_id": "Шимон", "text": "Да нет в жизни счастья", "durability": "long"}, {"speaker_id": "Шимон", "text": "Я одинокий волк", "durability": "long"}, {"speaker_id": "Казах", "text": "Это да, но мы в силах порадовать себя", "durability": "long"}, {"speaker_id": "Шимон", "text": "Это как?", "durability": "long"}, {"speaker_id": "Казах", "text": "Каждый по своему", "durability": "long"}, {"speaker_id": "Шимон", "text": "Ты как?", "durability": "long"}, {"speaker_id": "Казах", "text": "Посмотрели фильм, пью чаек. Отдыхаю", "durability": "long"}, {"speaker_id": "Казах", "text": "Ты до 8-ми сегодня?", "durability": "long"}, {"speaker_id": "Казах", "text": "Или до 6-ти?", "durability": "long"}, {"speaker_id": "Шимон", "text": "Как ты готов порадовать меня", "durability": "long"}, {"speaker_id": "Шимон", "text": "Нет", "durability": "long"}, {"speaker_id": "Шимон", "text": "Нет", "durability": "long"}, {"speaker_id": "Шимон", "text": "До 19", "durability": "long"}], "entities": [{"name": "Кан", "type": "person", "aliases": ["Кан"], "relations": [{"subject": "Казах", "predicate": "указывает на", "object": "Кан", "durability": "long", "when": "в ходе обсуждения личных трудностей"}]}, {"name": "медиа", "type": "other", "aliases": ["<media>"], "relations": [{"subject": "Шимон", "predicate": "отправляет", "object": "медиа", "durability": "long", "when": "во время обсуждения"}, {"subject": "Казах", "predicate": "отправляет", "object": "медиа", "durability": "long", "when": "во время обсуждения"}]}], "alias_map": {"Кан": "Кан", "<media>": "медиа"}}, "dedup_key": "5bc9980b1c9b0fb4076f840196247099b54c1fb7", "alias_map": {"Кан": "Кан", "<media>": "медиа"}}
